{
  "$schema": "https://json-schema.org/draft/2020-12/schema",
  "$id": "https://cam-assist.lutherie/schemas/creation_studio_request.schema.json",
  "title": "CAM Assist Creation Studio Capability Request Schema",
  "description": "Portable, reference-only capability request describing what downstream machining-development assistance CAM Assist is requesting from the separate CAM-Creation-Studio product. Direction is strictly CAM Assist -> CAM-Creation-Studio (outbound, advisory). A contract-first interoperability probe: it names desired downstream analysis (feeds/speeds, tooling, sequencing, simulation, toolpath development, etc.) and points at the package's manifest, strategy, review packet, and — when available — its traceability bundle and production shop handoff. It does not own, copy, or mutate the referenced files. The request is advisory only: it does not authorize machine execution, does not bypass human review, does not confirm machine readiness, does not require G-code generation, and does not assert that CAM-Creation-Studio supports any requested capability. It introduces no CAM-Creation-Studio runtime dependency and carries no created_at (the artifact is deterministic and reproducible; regeneration is byte-identical). Structural validation does not require the referenced files to exist (existence is an opt-in completeness concern).",
  "type": "object",
  "required": ["record_type", "record_version", "package_reference", "request_direction", "requested_capabilities", "contents", "authority"],
  "additionalProperties": false,

  "properties": {
    "record_type": {
      "type": "string",
      "const": "cam_assist_creation_studio_request",
      "description": "Must be 'cam_assist_creation_studio_request'"
    },

    "record_version": {
      "type": "string",
      "pattern": "^[0-9]+\\.[0-9]+\\.[0-9]+$",
      "description": "Semantic version of the request record FORMAT."
    },

    "package_reference": {
      "type": "string",
      "minLength": 1,
      "pattern": "\\S",
      "description": "Reference to the package this request concerns. Accepts federated_package_id, relative path, or package directory name."
    },

    "request_direction": {
      "type": "string",
      "const": "cam_assist_to_creation_studio",
      "description": "Must be 'cam_assist_to_creation_studio'. The seam is outbound only; no inbound authority is ever expressed."
    },

    "requested_capabilities": {
      "type": "array",
      "minItems": 1,
      "uniqueItems": true,
      "items": {
        "type": "string",
        "enum": [
          "feeds_speeds_recommendation",
          "tooling_review",
          "operation_sequence_analysis",
          "cycle_time_estimation",
          "simulation_request",
          "gcode_explanation",
          "toolpath_development_request",
          "workholding_review"
        ]
      },
      "description": "Non-empty, unique list of requested downstream capabilities from the v1 vocabulary. Describes requested assistance only; does not guarantee CAM-Creation-Studio supports the capability."
    },

    "contents": {
      "type": "object",
      "description": "Map of references to the package artifacts this request concerns, resolved relative to the request file's own location. References are navigational only; the referenced files remain authoritative and are never owned, copied, or mutated. Only the known slots below are permitted; no individual slot is required.",
      "additionalProperties": false,
      "properties": {
        "package_manifest_file": {
          "type": "string",
          "minLength": 1,
          "pattern": "^(?![\\\\/])(?![A-Za-z]:)\\S",
          "description": "Reference to the package manifest.json. Relative path only (no absolute or drive-rooted path); resolved relative to the request file's own location."
        },
        "strategy_file": {
          "type": "string",
          "minLength": 1,
          "pattern": "^(?![\\\\/])(?![A-Za-z]:)\\S",
          "description": "Reference to the package strategy file. Relative path only."
        },
        "review_packet_file": {
          "type": "string",
          "minLength": 1,
          "pattern": "^(?![\\\\/])(?![A-Za-z]:)\\S",
          "description": "Reference to the package review packet. Relative path only."
        },
        "traceability_bundle_file": {
          "type": "string",
          "minLength": 1,
          "pattern": "^(?![\\\\/])(?![A-Za-z]:)\\S",
          "description": "Reference to the traceability bundle (CAM-A19), included when available. Relative path only."
        },
        "production_shop_handoff_file": {
          "type": "string",
          "minLength": 1,
          "pattern": "^(?![\\\\/])(?![A-Za-z]:)\\S",
          "description": "Reference to the production shop handoff (CAM-A20), included when available. Relative path only. Distinct from the request itself: the handoff remains a separate outbound artifact."
        }
      }
    },

    "request_context": {
      "type": "object",
      "description": "Optional, informational-only context for the request. No field grants authority or changes validity. Closed to the known fields below.",
      "additionalProperties": false,
      "properties": {
        "material": {
          "type": "string",
          "minLength": 1,
          "pattern": "\\S",
          "description": "Informational material description (e.g., 'mahogany'). Non-blank when present."
        },
        "machine_profile": {
          "oneOf": [
            {"type": "string", "minLength": 1, "pattern": "\\S"},
            {"type": "null"}
          ],
          "description": "Informational machine profile reference (non-blank string), or null when unspecified."
        },
        "operator_notes": {
          "type": "string",
          "minLength": 1,
          "pattern": "\\S",
          "description": "Informational free-text notes for the downstream reviewer. Non-blank when present."
        }
      }
    },

    "authority": {
      "type": "object",
      "description": "Informational authority constraints. REQUIRED on a request. Every flag MUST be true.",
      "required": [
        "is_informational",
        "does_not_authorize_execution",
        "does_not_bypass_human_review",
        "does_not_confirm_machine_readiness",
        "does_not_require_gcode_generation"
      ],
      "additionalProperties": false,
      "properties": {
        "is_informational": {
          "type": "boolean",
          "const": true,
          "description": "MUST be true. This record is informational only."
        },
        "does_not_authorize_execution": {
          "type": "boolean",
          "const": true,
          "description": "MUST be true. This record does not authorize machine execution."
        },
        "does_not_bypass_human_review": {
          "type": "boolean",
          "const": true,
          "description": "MUST be true. This record does not bypass required human review."
        },
        "does_not_confirm_machine_readiness": {
          "type": "boolean",
          "const": true,
          "description": "MUST be true. This request does NOT assert that the package is machine-ready."
        },
        "does_not_require_gcode_generation": {
          "type": "boolean",
          "const": true,
          "description": "MUST be true. This request does not require or authorize G-code generation inside CAM Assist."
        }
      }
    }
  }
}
